	af_id	af_hidden	af_global	af_enabled	af_deleted	af_throttled	af_group	af_timestamp	af_actions	af_hit_count	af_public_comments	manual_tags	notes
0	61	0	0	1	0	0	default	20170514124327	tag	1611956	New user removing references	good_faith	probably
1	135	0	0	1	0	0	default	20150225210144	warn,tag	1371361	Repeating characters	vandalism	
2	527	1	0	1	0	0	default	20161204020134	throttle	1241576	T34234: log/throttle possible sleeper account creations	vandalism/	needs subtag? Account creation != defacing content
3	384	0	0	1	0	0	default	20181018171832	disallow	1159239	Addition of bad words or other vandalism	vandalism	
4	172	0	0	1	0	0	default	20170514124339	tag	935925	Section blanking	good_faith	
5	30	0	0	1	0	0	default	20181018234235	warn,tag	840871	Large deletion from article by new editors	good_faith	
6	633	0	0	1	0	0	default	20181218191236	tag	808716	Possible canned edit summary	good_faith/lazyness	
7	636	0	0	1	0	0	default	20181231024947	warn	726764	Unexplained removal of sourced content	vandalism/good_faith	the warning suggests, editors should add edit summary
8	3	0	0	1	0	0	default	20181018194624	warn,tag	700522	New user blanking articles	good_faith	
9	650	0	0	1	0	0	default	20160721182156		695601	Creation of a new article without any categories	good_faith	
10	279	0	0	1	0	0	default	20190104180929	throttle,tag	616212	Repeated attempts to vandalize	vandalism	
11	432	0	0	1	0	0	default	20160614010135	warn,tag	558578	Starting new line with lowercase letters	good_faith/lazyness	needs subtag? For people not adhering to grammar/orthography norms/encyclopedia style
12	225	0	0	1	0	0	default	20180807154519	disallow	482872	Vandalism in all caps	vandalism	
13	50	0	0	1	0	0	default	20181018234925	warn,tag	480960	Shouting	vandalism/good_faith	or other subtag
14	189	0	0	1	0	0	default	20160629222729	tag	466012	BLP vandalism or libel	vandalism/harassment	
15	132	0	0	1	0	0	default	20170514124337	warn,tag	420273	Removal of all categories	vandalism/good_faith	“new editor” may mean good faith (i.e. person not familiar with norms) but also vandalism (freshly created account for the specific purpose of libel)
16	380	1	0	1	0	0	default	20181103012136	disallow	394328	Multiple obscenities	vandalism/harassment	since filter is hidden, not clear in which name space are the targeted edits
17	231	0	0	1	0	0	default	20181203165338	warn,tag	380302	Long string of characters containing no spaces	vandalism	will not be true for German^^
18	364	1	0	1	0	0	default	20170514124359	tag	368604	Changing the name in a BLP infobox	vandalism	no “good_faith” tag since filter is hidden
19	46	0	0	1	0	0	default	20181023193500	disallow	356945	"""Poop"" vandalism"	vandalism	
20	98	0	0	1	0	0	default	20180802160245	tag	339401	Creating very short new article	good_faith	
21	220	0	0	1	0	0	default	20170514124344	warn,tag	303179	Adding external images/links	misc	why is this a problem? Bc external resources may be broken? Or get removed? Or violate copyright (is this a  valid concern for *external* resources?)
22	260	0	0	1	0	0	default	20181130204255	disallow	286852	Common vandal phrases	vandalism	
23	686	0	0	1	0	0	default	20170925141542		282934	IP adding possibly unreferenced material to BLP	vandalism/harassment/biased_pov	need an extra tag for biased point of view
24	148	0	0	1	0	0	default	20160222132707	tag	242321	Users creating autobiographies	biased_pov	
25	491	0	0	1	0	0	default	20170514124404	warn,tag	230416	Edits ending with emoticons or !	bad_style	
26	833	0	0	1	0	0	default	20171226170048		221466	Newer user possibly adding unreferenced or improperly referenced material	good_faith	
27	712	0	0	1	0	0	default	20170514124418		209612	Possibly changing date of birth in infobox	good_faith, misc	
28	79	0	0	1	0	0	default	20170514124330	warn,tag	205958	New user removing reference grouping tags	good_faith	what are “reference grouping tasks”?
29	550	0	0	1	0	0	default	20180412174000	tag	202352	nowiki tags inserted into an article	misc	what are “nowiki” tags?
30	149	0	0	1	0	0	default	20171208034036	warn,tag	194824	User adds link containing username	misc	don’t understand this one either
31	29	0	0	1	0	0	default	20181018234133	tag	186026	New user removing speedy deletion templates	good_faith	
32	344	0	0	0	1	0	default	20160614031628	warn	180995	Prevent full page blanking	good_faith	Filter is deleted
33	180	0	0	1	0	0	default	20171025200431	tag	175939	Large unwikified new article	good_faith	
34	351	0	0	1	0	0	default	20170514124357	warn,tag	171171	Text added after categories and interwiki	good_faith?	
35	391	0	0	1	0	0	default	20170514124402	tag	163579	Changing height/weight in an infobox	vandalism	Common form of vandalism for sports people pages
36	402	0	0	0	1	0	default	20130404080808		155133	New article without references	good_faith	deleted
37	320	0	0	1	0	0	default	20181023193636	disallow	152994	"""Your mom"" Vandalism"	vandalism	
38	39	0	0	1	0	0	default	20181020203444	warn,tag	150568	School libel and vandalism	vandalism	
39	18	0	0	0	1	0	default	20120202004352		133641	Test type edits from clicking on edit bar	lazyness	deleted
40	631	0	0	1	0	0	default	20170514124409	tag	132044	Extraneous toolbar markup	good_faith	“Filter to detect most commonly seen extraneous markup inserted via the Toolbar from new users, presumably the result of misclicking. Log only”
41	12	0	0	1	0	0	default	20170606215509	disallow	122756	Replacing a page with obscenities	vandalism	
42	247	1	0	1	0	0	default	20180412174428	warn,tag	121192	Adding emails in articles	misc?, harassment?	filter is hidden, so not clear whether it’s biased_pov or doxxing
43	80	0	0	1	0	0	default	20190104180905	throttle,warn,tag	119104	Link spamming	vandalism, biased_pov, seo	
44	354	1	0	1	0	0	default	20181125142759	tag	115814	Promotional text added by user to own user(-talk) page	biased_pov	
45	11	0	0	1	0	0	default	20181018194241	warn,tag	109657	You/He/She/It sucks	vandalism, harassment	
46	499	1	0	1	0	0	default	20150819133615		106559	Possible spambot or promotional username	vandalism, biased_pov, seo	filter is hidden
47	680	0	0	1	0	0	default	20181023195329	disallow	95242	Adding emoji unicode characters	good_faith	
48	34	1	0	1	0	0	default	20181018234459	disallow	93880	New or unregistered user blanking someone else's user or user talk page	good_faith, vandalism	probably at least partially vandalism, since filter is hidden
49	752	1	0	1	0	0	default	20170514124428		93854	Possible spamming of references	vandalism, biased_pov, seo	hidden
50	271	1	0	0	1	0	default	20181104190824	warn	91822	Possible spambot	vandalism, biased_pov, seo	
51	614	1	0	1	0	0	default	20190101052937	disallow	90578	Yolo swag and other vandalism trends	vandalism	tagged as vandalism only, since hidden and not clear
52	188	0	0	0	1	0	default	20150212173350		86463	Creating articles with a title containing or contained in username	biased_pov?	deleted, bc apparently redundant with 148
53	339	0	0	1	0	0	default	20170514124352	tag	86338	Claims of homosexuality, bisexuality, or transexuality in a BLP	vandalism, harassment	
54	365	0	0	1	0	0	default	20181023193820	disallow	85470	Unusual changes to featured or good content	vandalism	Unusual == unusually big (edit_delta > 15000 | edit_delta < -15000)
55	65	0	0	0	1	0	default	20100106173457		74098	Excessive whitespace	vandalism, good_faith?	deleted
56	325	0	0	0	1	0	default	20120808231331	disallow	73942	!!!!! in the article-space	misc?, bad_style	new tag needed for “overly agitated person”? deleted 
57	285	0	0	0	0	0	default	20160911181242	disallow	73902	Common Vandalism	vandalism	disabled;  merged into 384 
58	126	0	0	1	0	0	default	20160713155301		65137	Youtube links	misc?	what’s the argumentation here? Youtube not suitable as encyclopedia source?  from the comments “Attempt to design a filter for continuous abuse on a handful of BBC articles Continuous insertion of youtube movies, undoing XLinkBot reverts, etc. etc.” 
59	129	0	0	0	1	0	default	20150212173327		64869	Possible tireless sock creating film pages of non-existing films	vandalism	extra tag for sockpuppeting? Deleted
60	423	0	0	0	1	0	default	20160614032412		64591	WikiLove	misc	deleted  “Purpose of this filter: Track usage of the WikiLove tool, both by new and experienced users, to watch for use and abuse. We'll have better tracking tools soon, but right now this is a simple solution to watch what's going on. To reduce impact on patrollers, it merely flags the edits. Please discuss with [[User:Eloquence]] if you have comments or questions. Since this filter is in active use by a number of people, please do not disable without discussion. 1908 -- Erik Moeller, WMF, 2011-07-01“ 
61	33	0	0	1	0	0	default	20181018234422	warn,tag	60707	Talk page blanking by unregistered/new user	vandalism, good_faith?	
62	270	0	0	0	1	0	default	20170509185805	tag	56352	Interwiki link removal	vandalism	deleted
63	867	0	0	1	0	0	default	20181018194458		51805	Large creations by inexperienced user	good_faith	
64	346	0	0	1	0	0	default	20170514124354	warn,tag	49652	Large non-English contributions	good_faith, vandalism?	
65	458	0	0	0	1	1	default	20140303202151	disallow	46898	Feedback: Extremely short post	good_faith?	deleted  couple of official WMF people, identified as such, are discussing on the filter in the comments 
66	806	1	0	1	0	0	default	20181012022640	throttle	46840	New account suspicious activity	vandalism?	hidden
67	803	0	0	1	0	0	default	20181023223916	disallow	46756	Prevent new users from editing other's user pages	vandalism, good_faith	
68	117	0	0	1	0	0	default	20160614004645	tag	43822	removal of Category:Living people	good_faith?	
69	316	1	0	1	0	0	default	20150218175744	throttle	43756	Subtle changes to articles	misc?	hidden
70	368	0	0	0	1	0	default	20150212173530	warn	42952	Making large changes when marking the edit as minor	good_faith?	deleted
71	249	0	0	1	0	0	default	20180328195529	throttle,tag	41712	New user conducting large scale reverts	good_faith?, vandalism?	
72	9	0	0	0	0	0	default	20181018194855		41354	Personal attacks by unregistered or new user	harassment	disabled
73	1	0	0	0	0	0	default	20181017165127		40258	General test filter	test	disabled
74	466	1	0	1	0	0	default	20161229063919	warn,tag	38064	Userspace & talk page spamming	vandalism?, harassment?	hidden
75	753	0	0	1	0	0	default	20160407115749	tag	36983	wikilinks removed by a new user or IP	vandalism	Self-identified, talks about “ to flag potential edits by IP hopping redlink removal vandal.”
76	58	1	0	1	0	0	default	20190106084020	disallow	35223	Long-term pattern abuse	vandalism?	hidden
77	31	1	0	1	0	0	default	20171016132909	disallow	34966	ASCII art	vandalism?	hidden
78	164	0	0	1	0	0	default	20150218122411	tag	34351	Possible cut and paste moves	good_faith	
79	716	0	0	1	0	0	default	20151205214255		34135	New user tagging or de-tagging article as FA/GA	good_faith?, vandalism?	
80	96	0	0	0	1	0	default	20150212173317		33114	Newly created articles that don't mention their subject	good_faith?	deleted; not quite sure what “not mention title” means anyway..the title wasn’t mentioned where?
81	167	0	0	1	0	0	default	20150724165931	warn	32972	Botched submissions to Articles for creation	good_faith	
82	323	0	0	1	0	0	default	20160614005551	tag	31881	Undoing anti-vandalism bot	possible vandalism	
83	613	0	0	0	1	0	default	20160614035203	warn,tag	28327	Signing in article	good_faith?	deleted
84	728	0	0	0	1	0	default	20151006132227	tag	25869	Huggle	maintenance	deleted; “This is a filter that marks all edits made by huggle, so that they can be easily filtered out or ignored by other tools”
85	627	0	0	1	0	0	default	20181125143134	tag	24764	Promotional text added by user to draft in own user(-talk) page or in draft namespace	biased_pov	extra tag for self-promotion? (not every biased_pov is a sales pitch)
86	846	0	0	1	0	0	default	20170406020700	tag	24283	LTA tracking	vandalism?	
87	623	1	0	0	1	0	default	20160614035424	disallow	24030	Signing in articles II	misc	deleted, hidden;
88	664	0	0	1	0	0	default	20181111001413	warn	22539	Test edits	good_faith	
89	342	0	0	0	1	0	default	20160614031603		21810	Redirect becoming article	good_faith?	deleted;
90	657	0	0	1	0	0	default	20150923100538	warn,tag	21684	Adding an external link to a disambiguation page	good_faith?	
91	113	0	0	1	0	0	default	20181111001344	warn,tag	20885	Misplaced #redirect in articles	good_faith	
92	711	0	0	1	0	0	default	20171009011036		20699	Dead link replacement	seo, vandalism?	
93	460	0	0	0	1	0	default	20140303202225	disallow	20505	Feedback: Foul words	vandalism, harassment	deleted;
94	59	0	0	1	0	0	default	20181018235413	tag	19938	New user removing templates on image description	good_faith?	
95	174	0	0	1	0	0	default	20170514124342	warn,tag	19223	New user removing XfD template	good_faith?, vandalism?	
96	520	0	0	0	1	1	default	20140303202339	disallow	18596	Feedback: No punctuation or spaces	misc	deleted; throttled
97	397	1	0	1	0	0	default	20181108195959	disallow	18114	Userpage vandalism	vandalism	hidden
98	155	0	0	0	1	0	default	20090928230926		17517	Adding links to youtube	misc	deleted; there was another (also deleted?) youtube filter. Still don’t understand the purpose of them
99	782	0	0	1	0	0	default	20181023223745	disallow	16702	Content Translation Edits	misc	why is this not allowed? Seems to be translating a page from another language version of Wikipedia..
100	655	0	0	1	0	0	default	20160520185734	tag	16051	Large plot section addition	good_faith?, bad_style?	
101	602	0	0	1	0	0	default	20180331105543	warn,tag	15758	Arbitration discretionary sanctions alerts	misc	don’t understand this one either
102	205	1	0	0	1	0	default	20110310110641		15519	Scibaby #1	misc	hidden, deleted;
103	106	0	0	0	1	0	default	20090830005331		14513	Date linking / delinking	misc	deleted; don’t quite get it...
104	2	1	0	0	0	0	default	20181008172604		14104	Test filter: for testing private filters	test	hidden, disabled;
105	51	1	0	1	0	0	default	20181230024907		14060	LTA Username / LTA IP hopping disruption (Oshwah)	misc	hidden; what’s LTA?
106	224	0	0	1	0	0	default	20170910203050	tag	13895	Copyvio tag removal	misc?, copyright?	
107	420	0	0	1	0	0	default	20181211033934	throttle,disallow	13874	Large removal of talk page content by IP	vandalism?	
108	345	0	0	1	0	0	default	20160614031816	warn,tag	13832	Extraneous formatting from browser extension	bug?	
109	733	0	0	1	0	0	default	20151102053740		13770	New user creating a page in someone else's userspace	vandalism, good_faith	
110	554	0	0	1	0	0	default	20181023194722	disallow	13394	top100 blog charts	seo?, vandalism?, spam?	
111	630	1	0	1	0	0	default	20150725140936	tag	13025	New users de-userfying pages	misc	hidden; no idea what’s that supposed to mean
112	28	0	0	0	1	0	default	20100106173322		12264	New user redirecting an existing substantial page or changing a redirect	good_faith?	deleted;
113	366	0	0	0	1	0	default	20110310111443		12257	Addition of seemingly random characters	vandalism	deleted;
114	819	1	0	0	0	0	default	20190104180937	throttle	12207	Derp vandal	misc? Vandalism	hidden; possibly referring to https://en.wikipedia.org/wiki/Derp_(hacker_group)
115	837	0	0	1	0	0	default	20170208212523		12174	Removal of disambiguation templates by new users	good_faith?	
116	102	1	0	1	0	0	default	20181128153750	disallow	11903	Abusive account names	vandalism?	hidden;
117	532	0	0	0	1	0	default	20160614033920	tag	11857	Interwiki Addition	misc	deleted, possibly good_faith
118	559	1	0	1	0	0	default	20170514124407		11787	archive.is additions	misc	hidden;
119	825	1	0	0	0	0	default	20180424212713		11749	Descent category added	misc	hidden;
120	77	1	0	0	1	0	default	20160818205501	warn	11528	Various ASCII Vandals	vandalism	hidden, deleted;
121	76	0	0	0	1	0	default	20150212173255	warn	11033	Adding email address	misc	deleted
122	394	0	0	0	1	0	default	20120808231420		10996	Extremely short article creation	good_faith?, vandalism?	deleted;
123	409	0	0	0	1	0	default	20120808231558		10880	news sources on BLPs	biased_pov?	deleted;
124	773	1	0	0	0	0	default	20181220031744		9990	TNT's test filter	test	hidden;
125	890	0	0	1	0	0	default	20181207113011	warn,disallow	9932	Random typing in username	vandalism?	“This is fascinating: the lack of output from the previous suggests that people are creating these random-typing accounts, but never using them...  -- The Anome, 19 May 2018”
126	697	0	0	0	0	0	default	20151230224636		9807	User making large contribution with first edits	good_faith?, vandalism?, biased_pov	disabled
127	218	0	0	0	1	0	default	20150212173428		9802	User adding xx/xx/xxxx probably a date	misc	deleted
128	483	1	0	0	1	0	default	20160614033218		9357	Users creating own talk	misc	deleted, hidden; why is this hidden? And why is it problematic so a filter is needed at all?
129	163	0	0	0	1	0	default	20181104190423	warn,tag	9289	Redirect to non-existent page	good_faith?, vandalism?	deleted;
130	784	0	0	1	0	0	default	20170419165539	disallow	9265	Harambe vandalism	vandalism	https://en.wikipedia.org/wiki/Killing_of_Harambe
131	735	0	0	1	0	0	default	20170514124421	tag	9005	Vandalising sport infobox	vandalism	
132	531	0	0	0	1	0	default	20160614033912	tag	8856	Interwiki Removal	good_faith?, vandalism?	deleted; not feasible to review all the hits
133	81	0	0	0	1	0	default	20150625141029		8491	Badcharts	seo?, vandalism?, spam?	deleted;
134	878	0	0	1	0	0	default	20180416160027	tag	8290	New user removing COI template	biased_pov, good_faith	COI=conflict of interest
135	521	0	0	0	1	0	default	20140303202349	disallow	8149	Feedback: All caps	not_polite/bad_style	deleted;
136	478	1	0	1	0	0	default	20181213063717	disallow	7862	Talk page abuse	vandalism?, harassment?	hidden;
137	875	1	0	0	0	0	default	20190104181008	warn	7585	Derp II	misc	hidden; may be vandalism again, vgl #819
138	912	0	0	1	0	0	default	20181230045936	warn,tag	7505	"Possible ""fortnite"" vandalism"	vandalism	
139	643	1	0	1	0	0	default	20181127140355	throttle	7109	Persistent sockpuppetry	vandalism?, sockpuppetry?	hidden;
140	261	1	0	0	0	0	default	20170928195215	throttle,disallow	6548	Page creation throttle for new users	vandalism?	hidden, disabled;
141	183	0	0	0	0	0	default	20150212182934	warn	6545	AFC submissions in wrong namespace	good_faith	disabled; afc=articles for creation
142	473	0	0	0	1	0	default	20140303202257	disallow	6369	Feedback: Repeating characters	vandalism?	deleted;
143	410	0	0	0	1	0	default	20120808231603		6285	blog added to BLPs	misc	deleted; bad_style? Why is this a problem?
144	905	0	0	0	1	0	default	20180415235317		6267	bots that may ping users	test?	deleted;
145	313	0	0	0	1	0	default	20150212173457	warn	6259	Skype Toolbar Formatting	bug?	deleted;
146	425	1	0	1	0	0	default	20170111031407		6209	Magic/astrology spambots	vandalism?, spam?	hidden;
147	796	1	0	1	0	0	default	20190103105102	throttle,disallow	6029	Possible Ref Desk disruption	misc	hidden;
148	97	0	0	0	1	0	default	20090807112403		5973	Personal attacks by new user	harassment	deleted; “(merged with 9)”
149	869	0	0	1	0	0	default	20180828225237	warn	5855	"Adding ""Daily Mail"" to articles"	biased_pov	https://en.wikipedia.org/w/index.php?title=Wikipedia:Administrators%27_noticeboard&oldid=794430458#Daily_Mail_redux
150	294	1	0	1	0	0	default	20150818185048	disallow	5395	Personal attacks	harassment?	hidden;
151	702	0	0	1	0	0	default	20171210235420	warn	5302	Warning against clipboard hijacking	biased_pov?, spam?	
152	152	0	0	0	1	0	default	20090928230917		5148	External links with referal tags	misc	deleted;
153	139	1	0	1	0	0	default	20181023224247	disallow	5135	Fixed position vandalism	vandalism	hidden;
154	463	1	0	0	1	0	default	20140303202236	disallow	4965	Feedback: Adding email addresses	harassment	hidden, deleted;
155	632	0	0	1	0	0	default	20150714131905	tag	4839	Creating blank pages	good_faith, spam	
156	874	1	0	1	0	0	default	20181219190423	disallow	4745	Long term abuse username / impersonation creations	harassment	hidden;
157	894	0	0	1	0	0	default	20180913023553	warn	4625	Possible Self-Published Sources	biased_pov	
158	887	0	0	1	0	0	default	20181105103817	warn,disallow	4589	Excessive repetition in usernames	vandalism?, spam?, sockpuppetry?	
159	895	1	0	0	0	0	default	20180927230229		4577	Possible spambot username	misc	hidden, disabled;
160	5	0	0	1	0	0	default	20181018194804	warn,tag	4558	User self-renaming or moving user talk pages into article talk space	good_faith?	
161	524	0	0	0	1	0	default	20160614033823		4502	Interwiki bot	test_bot?	deleted
162	435	0	0	0	1	0	default	20120906154650	warn	4380	Non-confirmed user adding protection template to a page	good_faith	deleted
163	789	1	0	0	0	0	default	20180412180509		4375	BethNaught's test filter	test	hidden, disabled;
164	464	1	0	1	0	0	default	20160614010306	warn	4290	Possible open proxy	misc	hidden
165	68	1	0	1	0	0	default	20181023224224	throttle,disallow	3905	Pagemove throttle for new users	vandalism?	hidden; tagged as “vandalism”, since hidden
166	238	0	0	0	1	0	default	20100217195031		3857	New article without normal opening sentence	vandalism	deleted
167	573	0	0	0	1	0	default	20160614034544		3718	Multiple blank lines	good_faith?, bad_style?	deleted
168	497	0	0	0	1	0	feedback	20130108151106	disallow	3660	Feedback: Common Vandalism 5	vandalism, harassment?	deleted; “Merged back into 460. --mlitn”
169	17	1	0	0	1	0	default	20170509184817	tag	3563	Prolific socker II	vandalism?, sockpuppetry?	hidden, deleted;
170	670	0	0	0	1	0	default	20150407175738		3514	New user removing references	test?, good_faith?	deleted
171	860	0	0	1	0	0	default	20181112215348	disallow	3451	Ryan Ross vandalism	vandalism	
172	105	0	0	0	1	0	default	20090928191623		3379	Hypothetical album releases	bad_style	deleted; “Detect the addition of hypothetical future album releases that usually violate WP:CRYSTAL and/or WP:V”;
173	494	0	0	0	1	0	feedback	20130108151035	disallow	3325	Feedback: Common Vandalism 2	vandalism?, harassment?	deleted; “Merged back into 460. --mlitn”
174	502	0	0	0	1	0	feedback	20130424011002	disallow	3280	Feedback: Extremely long words	vandalism?; good_faith?, bad_style?	deleted
175	777	0	0	1	0	0	default	20171210164915		3149	End date present vandal	vandalism	
176	579	1	0	1	0	0	default	20180923065811		3112	Possible sockpuppet account creations	vandalism?, sockpuppetry?	hidden
177	850	0	0	1	0	0	default	20170420153045	warn	3112	New user moving page to project space	good_faith?	
178	322	1	0	0	1	0	default	20120203223448	throttle	3091	Null edits by new editors	good_faith?, vandalism?	hidden, deleted;
179	289	0	0	0	1	0	default	20150212173453	warn	3051	New user creating interrogative pages	good_faith?, bad_style?	deleted
180	268	1	0	0	1	0	default	20150212173449	warn	2964	Red link vandalism	vandalism	hidden, deleted;
181	264	1	0	1	0	0	default	20170511025503	disallow	2919	Specific-page vandalism	vandalism	hidden
182	52	1	0	1	0	0	default	20181006230705	disallow	2890	Edit summary vandalism II	vandalism	hidden
183	590	0	0	0	0	0	default	20170414185610		2850	Unicode replacement characters	good_faith?, bad_style?	disabled
184	176	0	0	0	1	0	default	20090928230931		2820	user space link added in article space	good_faith?, bad_style?	deleted
185	721	1	0	1	0	0	default	20171002133237	disallow	2770	Armenian football vandal or similar	vandalism	hidden
186	593	0	0	0	1	0	default	20140102185042		2764	Monitor addition of archive.org	misc?	deleted; “Repurposed to monitor anons inserting archive.org links, so that 559 blocks archive.is only, and 593 monitors archive.org”
187	495	0	0	0	1	0	feedback	20130108151045	disallow	2697	Feedback: Common Vandalism 3	vandalism, harassment?	deleted; “Merged back into 460. --mlitn”
188	479	0	0	0	1	0	default	20160614033123	warn	2692	Adding example.jpg to article space	good_faith	deleted; “Deleting, superseded by [[Special:AbuseFilter/631]] ~MA 2016.06.13”
189	783	0	0	1	0	0	default	20170418154458	warn	2677	Adding {{persondata}}	good_faith	according to comments; I don’t quite get what it is
190	496	0	0	0	1	0	feedback	20130108151054	disallow	2658	Feedback: Common Vandalism 4	vandalism, harassment?	deleted; “Merged back into 460. --mlitn”
191	403	1	0	0	1	0	default	20130404080817		2605	Inappropriate use of userpage	vandalism?, biased_pov?	hidden, deleted;
192	53	0	0	0	1	0	default	20090423131929		2595	trademark/copyright symbols	spam?, copyright_violation?	deleted
193	840	0	0	0	0	0	default	20181008213422		2532	Indexing user pages	misc	disabled
194	242	1	0	1	0	0	default	20150219194933	throttle,disallow	2531	Redirecting a substantial existing page - new user throttle	misc, vandalism?	hidden
195	898	1	0	1	0	0	default	20180414083948		2343	Cyp test filter	test	hidden
196	904	0	0	0	1	0	default	20180406183614		2338	Long edit summaries	test	deleted
197	861	0	0	1	0	0	default	20181224172959		2256	Crow test filter	test	
198	732	1	0	0	1	0	default	20170402074526	disallow	2195	Chinese spam attack?	spam?, vandalism?	hidden, deleted;
199	233	1	0	0	1	0	default	20101104003357	disallow	2189	Targeted user talk vandalism	vandalism?, harassment?	hidden, deleted;
200	239	0	0	0	1	0	default	20091127160915	disallow	2189	Huge repeating/nonsense characters	vandalism	deleted
201	159	1	0	0	1	0	default	20170402073529	throttle,disallow	2171	Mascot Guy Sock Candidates	sockpuppetry?, vandalism	deleted, hidden;
202	472	0	0	0	1	1	default	20140303202248		2133	Feedback: Addition of bad words	vandalism, harassment?	deleted; “Merged to 460. --Reaper 2012-08-17”
203	236	1	0	0	1	0	default	20110316135512		2116	Wknight94 test filter	test	deleted, hidden;
204	35	0	0	0	1	0	default	20090511155617		2093	New user changing a redirect	vandalism?, good_faith?	deleted; “Merged to the filter 28 and disabled – Ruslik“
205	23	1	0	0	1	0	default	20160812194609		2075	Some vandal phrases	vandalism	deleted, hidden;
206	935	1	0	1	0	0	default	20180923090952		2056	"""ntsamr""-pattern spambot filter"	misc	hidden
207	637	1	0	0	0	0	default	20190103014127		2040	MusikAnimal test filter	test	hidden
208	16	1	0	0	1	0	default	20170509184759	throttle,disallow	2005	Prolific socker I	sockpuppetry	hidden, deleted;
209	273	1	0	0	1	0	default	20120808231233	disallow	1980	Repeated obscenities	vandalism?, harassment?	hidden, deleted;
